{
  "artifact_version": "workflow-definition/1.0",
  "workflow_version": "episode-production-workflow/1.0",
  "claims": [
    {
      "claim_id": "artifact_graph_valid",
      "dependency_claim_ids": [],
      "gate_id": "gate.artifact_graph_valid"
    },
    {
      "claim_id": "brief_present",
      "dependency_claim_ids": [
        "artifact_graph_valid"
      ],
      "gate_id": "gate.brief_present"
    },
    {
      "claim_id": "storyboard_present",
      "dependency_claim_ids": [
        "brief_present"
      ],
      "gate_id": "gate.storyboard_present"
    },
    {
      "claim_id": "storyboard_review_pass",
      "dependency_claim_ids": [
        "storyboard_present"
      ],
      "gate_id": "gate.storyboard_review_pass"
    },
    {
      "claim_id": "storyboard_approval_current",
      "dependency_claim_ids": [
        "storyboard_review_pass"
      ],
      "gate_id": "gate.storyboard_approval_current"
    },
    {
      "claim_id": "packet_present",
      "dependency_claim_ids": [
        "storyboard_approval_current"
      ],
      "gate_id": "gate.packet_present"
    },
    {
      "claim_id": "packet_contract_valid",
      "dependency_claim_ids": [
        "packet_present"
      ],
      "gate_id": "gate.packet_contract_valid"
    },
    {
      "claim_id": "packet_review_pass",
      "dependency_claim_ids": [
        "packet_contract_valid"
      ],
      "gate_id": "gate.packet_review_pass"
    },
    {
      "claim_id": "feasibility_pass",
      "dependency_claim_ids": [
        "packet_contract_valid"
      ],
      "gate_id": "gate.feasibility_pass"
    },
    {
      "claim_id": "generation_approval_current",
      "dependency_claim_ids": [
        "packet_review_pass",
        "feasibility_pass"
      ],
      "gate_id": "gate.generation_approval_current"
    },
    {
      "claim_id": "generation_mode_permits_execution",
      "dependency_claim_ids": [
        "generation_approval_current"
      ],
      "gate_id": "gate.generation_mode_permits_execution"
    },
    {
      "claim_id": "workspace_trusted",
      "dependency_claim_ids": [
        "generation_mode_permits_execution"
      ],
      "gate_id": "gate.workspace_trusted"
    },
    {
      "claim_id": "shot_qc_pass",
      "dependency_claim_ids": [
        "workspace_trusted"
      ],
      "gate_id": "gate.shot_qc_pass"
    },
    {
      "claim_id": "continuity_qc_pass",
      "dependency_claim_ids": [
        "shot_qc_pass"
      ],
      "gate_id": "gate.continuity_qc_pass"
    },
    {
      "claim_id": "candidate_ranking_current",
      "dependency_claim_ids": [
        "continuity_qc_pass"
      ],
      "gate_id": "gate.candidate_ranking_current"
    },
    {
      "claim_id": "edit_manifest_current",
      "dependency_claim_ids": [
        "candidate_ranking_current"
      ],
      "gate_id": "gate.edit_manifest_current"
    },
    {
      "claim_id": "rough_cut_pass",
      "dependency_claim_ids": [
        "edit_manifest_current"
      ],
      "gate_id": "gate.rough_cut_pass"
    },
    {
      "claim_id": "final_delivery_present",
      "dependency_claim_ids": [
        "rough_cut_pass"
      ],
      "gate_id": "gate.final_delivery_present"
    },
    {
      "claim_id": "final_delivery_valid",
      "dependency_claim_ids": [
        "final_delivery_present"
      ],
      "gate_id": "gate.final_delivery_valid"
    },
    {
      "claim_id": "final_review_pass",
      "dependency_claim_ids": [
        "final_delivery_valid"
      ],
      "gate_id": "gate.final_review_pass"
    },
    {
      "claim_id": "publish_metadata_present",
      "dependency_claim_ids": [
        "final_delivery_valid"
      ],
      "gate_id": "gate.publish_metadata_present"
    },
    {
      "claim_id": "publish_metadata_bound",
      "dependency_claim_ids": [
        "publish_metadata_present"
      ],
      "gate_id": "gate.publish_metadata_bound"
    },
    {
      "claim_id": "publish_approval_current",
      "dependency_claim_ids": [
        "final_review_pass",
        "publish_metadata_bound"
      ],
      "gate_id": "gate.publish_approval_current"
    },
    {
      "claim_id": "external_publish_complete",
      "dependency_claim_ids": [
        "publish_approval_current"
      ],
      "gate_id": "gate.external_publish_complete"
    }
  ],
  "gates": [
    {
      "gate_id": "gate.artifact_graph_valid",
      "owner": "artifact-owner",
      "stable_reason_prefix": "workflow.artifact_graph_valid",
      "consumed_context_fields": [
        "rules_bundle_sha256"
      ]
    },
    {
      "gate_id": "gate.brief_present",
      "owner": "creator",
      "stable_reason_prefix": "workflow.brief_present",
      "consumed_context_fields": []
    },
    {
      "gate_id": "gate.storyboard_present",
      "owner": "creator",
      "stable_reason_prefix": "workflow.storyboard_present",
      "consumed_context_fields": []
    },
    {
      "gate_id": "gate.storyboard_review_pass",
      "owner": "reviewer",
      "stable_reason_prefix": "workflow.storyboard_review_pass",
      "consumed_context_fields": []
    },
    {
      "gate_id": "gate.storyboard_approval_current",
      "owner": "human-approver",
      "stable_reason_prefix": "workflow.storyboard_approval_current",
      "consumed_context_fields": [
        "workflow_definition_sha256",
        "policy_bundle_sha256",
        "rules_bundle_sha256",
        "effective_config_sha256",
        "current_manifest_sha256",
        "evidence_graph_sha256"
      ]
    },
    {
      "gate_id": "gate.packet_present",
      "owner": "creator",
      "stable_reason_prefix": "workflow.packet_present",
      "consumed_context_fields": []
    },
    {
      "gate_id": "gate.packet_contract_valid",
      "owner": "creator",
      "stable_reason_prefix": "workflow.packet_contract_valid",
      "consumed_context_fields": []
    },
    {
      "gate_id": "gate.packet_review_pass",
      "owner": "reviewer",
      "stable_reason_prefix": "workflow.packet_review_pass",
      "consumed_context_fields": []
    },
    {
      "gate_id": "gate.feasibility_pass",
      "owner": "independent-reviewer",
      "stable_reason_prefix": "workflow.feasibility_pass",
      "consumed_context_fields": []
    },
    {
      "gate_id": "gate.generation_approval_current",
      "owner": "human-approver",
      "stable_reason_prefix": "workflow.generation_approval_current",
      "consumed_context_fields": [
        "workflow_definition_sha256",
        "policy_bundle_sha256",
        "rules_bundle_sha256",
        "effective_config_sha256",
        "current_manifest_sha256",
        "evidence_graph_sha256"
      ]
    },
    {
      "gate_id": "gate.generation_mode_permits_execution",
      "owner": "human-operator",
      "stable_reason_prefix": "workflow.generation_mode_permits_execution",
      "consumed_context_fields": [
        "effective_config_sha256"
      ]
    },
    {
      "gate_id": "gate.workspace_trusted",
      "owner": "workspace-authority",
      "stable_reason_prefix": "workflow.workspace_trusted",
      "consumed_context_fields": [
        "current_manifest_sha256"
      ]
    },
    {
      "gate_id": "gate.shot_qc_pass",
      "owner": "human-or-channel-tool",
      "stable_reason_prefix": "workflow.shot_qc_pass",
      "consumed_context_fields": []
    },
    {
      "gate_id": "gate.continuity_qc_pass",
      "owner": "qc-tool-or-reviewer",
      "stable_reason_prefix": "workflow.continuity_qc_pass",
      "consumed_context_fields": []
    },
    {
      "gate_id": "gate.candidate_ranking_current",
      "owner": "qc-tool",
      "stable_reason_prefix": "workflow.candidate_ranking_current",
      "consumed_context_fields": []
    },
    {
      "gate_id": "gate.edit_manifest_current",
      "owner": "human-editor",
      "stable_reason_prefix": "workflow.edit_manifest_current",
      "consumed_context_fields": []
    },
    {
      "gate_id": "gate.rough_cut_pass",
      "owner": "editor",
      "stable_reason_prefix": "workflow.rough_cut_pass",
      "consumed_context_fields": []
    },
    {
      "gate_id": "gate.final_delivery_present",
      "owner": "editor",
      "stable_reason_prefix": "workflow.final_delivery_present",
      "consumed_context_fields": []
    },
    {
      "gate_id": "gate.final_delivery_valid",
      "owner": "editor",
      "stable_reason_prefix": "workflow.final_delivery_valid",
      "consumed_context_fields": []
    },
    {
      "gate_id": "gate.final_review_pass",
      "owner": "reviewer",
      "stable_reason_prefix": "workflow.final_review_pass",
      "consumed_context_fields": []
    },
    {
      "gate_id": "gate.publish_metadata_present",
      "owner": "creator",
      "stable_reason_prefix": "workflow.publish_metadata_present",
      "consumed_context_fields": []
    },
    {
      "gate_id": "gate.publish_metadata_bound",
      "owner": "creator",
      "stable_reason_prefix": "workflow.publish_metadata_bound",
      "consumed_context_fields": []
    },
    {
      "gate_id": "gate.publish_approval_current",
      "owner": "human-approver",
      "stable_reason_prefix": "workflow.publish_approval_current",
      "consumed_context_fields": [
        "workflow_definition_sha256",
        "policy_bundle_sha256",
        "rules_bundle_sha256",
        "effective_config_sha256",
        "current_manifest_sha256",
        "evidence_graph_sha256"
      ]
    },
    {
      "gate_id": "gate.external_publish_complete",
      "owner": "human-publisher",
      "stable_reason_prefix": "workflow.external_publish_complete",
      "consumed_context_fields": []
    }
  ],
  "actions": [
    {
      "action_id": "resolve_artifact_graph",
      "satisfies_claim_id": "artifact_graph_valid",
      "required_claim_ids": [],
      "actor_role": "artifact-owner",
      "capability_id": "repair_artifact_graph",
      "risk": "R0",
      "authority_requirement": "policy",
      "priority": 0,
      "side_effect": false,
      "trigger_reason_codes": [],